query,dynFromId,meta,left,keyword,right
瞋,18,Northern Song-太平御覽-人事部七,剄，頭墮背后，兩目不,瞋,  《韓子》曰：田駟
瞋,18,Northern Song-太平御覽-人事部七,乂。其頭。中河，孟賁,瞋,視船人Ｍ袖植、目烈、
瞋,18,Northern Song-太平御覽-人事部七,，將朱亥著虎圈中。亥,瞋,視虎，眥血出濺虎，虎
瞋,18,Northern Song-太平御覽-人事部七,眼曰：「若旗鼓相望，,瞋,捃發，足使君亡魂喪膽
瞋,18,Northern Song-太平御覽-人事部一十四,此自在吾。白髮臨拔，,瞋,號呼：何我之冤，何子
瞋,18,Northern Song-太平御覽-人事部一十六,，移置南崗。夜夢魯肅,瞋,：「當殺汝父。」尋復
瞋,18,Northern Song-太平御覽-人事部十九,之袍，帶劍持車，罵詈,瞋,。后又得一折齒，方圓
瞋,18,Northern Song-太平御覽-人事部二十七,囊以量太祖輕重。許褚,瞋,瞪盼，超曰：「聞君有
瞋,18,Northern Song-太平御覽-人事部五十八,騎距後，飛據水斷橋，,瞋,橫矛曰：「我張益得也
瞋,18,Northern Song-太平御覽-人事部五十八,臺軍消息，一無所言，,瞋,謂胡曰：「君稱兵內侮
瞋,18,Northern Song-太平御覽-人事部五十九,！今日服未？」洪據地,瞋,曰：「諸袁事漢，四世
瞋,18,Northern Song-太平御覽-人事部五十九,焉！行矣，勉之！」苞,瞋,援桴，虜眾碎斬其師，
瞋,18,Northern Song-太平御覽-人事部六十二,有人，卿宜避我。」安,瞋,呵之曰：「吾不相與。
瞋,18,Northern Song-太平御覽-人事部六十三,！今日服未？」洪據地,瞋,曰：「諸袁事漢，四世
瞋,18,Northern Song-太平御覽-人事部六十九,數董龍作雞狗乎？」墮,瞋,而叱之。龍，榮之小字
瞋,18,Northern Song-太平御覽-人事部七十五,安在？」太祖指褚，褚,瞋,眄之，超不敢動。數日
瞋,18,Northern Song-太平御覽-人事部七十六,拒之。后飛據水斷橋，,瞋,橫槊曰：「張益德此，
瞋,18,Northern Song-太平御覽-人事部七十七,」大眼曰：「鼓旗相望,瞋,捃發。足使君目不能視
瞋,18,Northern Song-太平御覽-人事部七十七,怒。執朱亥著虎圈中，,瞋,視虎，終不敢動。  
瞋,18,Northern Song-太平御覽-人事部九十六,飲酒，醉，爭言而斗，,瞋,大叱，曰：「吾乃皇帝
瞋,18,Northern Song-太平御覽-人事部一百七,優，使說肥瘦。真扣刀,瞋,，言：「俳敢說，吾斬
瞋,18,Northern Song-太平御覽-人事部一百二十三,之，大號而泣，不中；,瞋,大呼，要中乃止。其母
瞋,18,Northern Song-太平御覽-人事部一百二十四,挑戰。樓煩欲射羽，羽,瞋,叱之。樓煩目不能視，
瞋,18,Northern Song-太平御覽-人事部一百二十四,怒，數責彪前后愆悖，,瞋,大呼，投折幾案，詈辱
瞋,18,Northern Song-太平御覽-人事部一百二十四,大怒，而展其足，按劍,瞋,，其聲如吼虎。  《
瞋,18,Northern Song-太平御覽-人事部一百二十四,，將朱亥著虎圈中，亥,瞋,視虎，眥皆裂血出，濺
瞋,18,Northern Song-太平御覽-人事部一百三十五,，故可得而禽也。使狐,瞋,，見其必殺之勢，雉亦
瞋,18,Northern Song-太平御覽-人事部一百三十六,時人為之語曰：「顏竣,瞋,與人官，謝莊笑而不與
瞋,18,Northern Song-太平御覽-人事部一百三十七,，飲酒醉，爭言而斗，,瞋,大呼。  桓子《新論
瞋,18,Northern Song-太平御覽-逸民部七,「取彼金。」公投鐮，,瞋,，拂手而言曰：「何子
瞋,18,Northern Song-太平御覽-宗親部五,愛過人。弟嵩嘗飲酒，,瞋,謂顗曰：「君才不及弟
瞋,18,Northern Song-太平御覽-樂部六,樂工辛骨咄拍不中，上,瞋,視之，骨咄憂懼，一夕
瞋,18,Northern Song-太平御覽-樂部十二,顧視太后，舉手踏足，,瞋,頷首，為殺縛之勢。太
瞋,18,Northern Song-太平御覽-釋部四,己經出家，有一同學多,瞋,別，值世主不稱，每槁
瞋,18,Northern Song-太平御覽-釋部四,道，好行布施，而性多,瞋,。今為宮亭廟神，周回
瞋,18,Northern Song-太平御覽-釋部四,布施故，珍玩甚豐，以,瞋,故，墮此神報。今見同
瞋,18,Northern Song-太平御覽-釋部四,母爭邪正，浮屢屈，既,瞋,不自忍，乃作《老子化
瞋,18,Northern Song-太平御覽-釋部四,者得無量罪，仰愿暫息,瞋,，當為法師誦一遍，即
瞋,18,Northern Song-太平御覽-儀式部一,風晦冥。武王舉黃鉞，,瞋,麾之，曰：「予在，天
瞋,18,Northern Song-太平御覽-儀式部一,，吏民遮道不得行，期,瞋,道左，曰：「蹕！」大
瞋,18,Northern Song-太平御覽-服章部三,曼胡之纓，短後之衣，,瞋,而語難，王乃說之。今
瞋,18,Northern Song-太平御覽-服章部九,，試以手板拍其背而不,瞋,乃將犀手板換暹竹者，
瞋,18,Northern Song-太平御覽-服章部十五,刺鼻不知嚏，踏面不知,瞋,嚙齒作步數，持此得勝
瞋,18,Northern Song-太平御覽-方術部三,子知之，屬使勿逐。守,瞋,，吐鶴瑟數升而愈。 
瞋,18,Northern Song-太平御覽-方術部十五,尚，光尚曰：「先帝大,瞋,不許數出。」帝大怒，
瞋,18,Northern Song-太平御覽-工藝部十一,與帝左右博，爭行，乃,瞋,大呼。又曰：晉靈公驕
瞋,18,Northern Song-太平御覽-工藝部十二,磚也。誤中一鬼腳；鬼,瞋,故病汝兒耳。但以酒飯
瞋,18,Northern Song-太平御覽-珍寶部五,，將朱亥著虎圈中。亥,瞋,視虎，眥裂，血出濺虎
瞋,18,Northern Song-太平御覽-飲食部一,。噲遂披帷西向而立，,瞋,視項王。項王按劍而跽
瞋,18,Northern Song-太平御覽-獸部一,奮鬛舐唇，倏來忽往；,瞋,電曜，發煽茸響。拉虎
瞋,18,Northern Song-太平御覽-獸部三,，將朱亥著虎圈中。亥,瞋,視虎，眥裂，血出濺虎
瞋,18,Northern Song-太平御覽-獸部四,遇虎爭一羊，亮乃案劍,瞋,斬羊腹，虎乃各以其半
瞋,18,Northern Song-太平御覽-羽族部十一,命左右試牽御衣，鳥輒,瞋,叱咤。歧王文學熊延京
瞋,18,Northern Song-太平御覽-鱗介部四,，召瑤治之。瑤入門便,瞋,大罵：「老魅！不守道
瞋,18,Northern Song-太平御覽-木部三,。文宣時已被酒，向嶺,瞋,，射中一株，未幾枯死
瞋,4,Warring States-商君書-君臣,而為之者，上與之也。,瞋,扼腕而語勇者得，垂衣
瞋,7,Xin-漢書-志,封之際，燕齊之間方士,瞋,扼掔，言有神僊祭祀致
瞋,7,Xin-漢書-傳,戟挑戰。樓煩欲射，羽,瞋,叱之。樓煩目不能視，
瞋,7,Xin-漢書-傳,人，兩人對曰：「將軍,瞋,張膽，出萬死不顧之計
瞋,8,Eastern Han-吳越春秋-夫差內傳,光之劍，仗屈盧之矛，,瞋,大言以執之。」越王曰
瞋,8,Eastern Han-吳越春秋-夫差內傳,，不可久留。」越王復,瞋,怒曰：「死者，人之所
瞋,14,Northern and Southern-後漢書-列傳,不得行，期騎馬奮戟，,瞋,大呼左右曰「旧」，眾
瞋,14,Northern and Southern-後漢書-列傳,恍忽，不覺所言。惲乃,瞋,詈曰：「所陳皆天文聖
瞋,14,Northern and Southern-後漢書-列傳,殺其子，未欲迫之。玄,瞋,呼曰：「姦人無狀，玄
瞋,14,Northern and Southern-後漢書-列傳,！今日服未？」洪據地,瞋,曰：「諸袁事漢，四世
瞋,14,Northern and Southern-後漢書-列傳,令人追殺佗，不及，因,瞋,，吐黑血數升而愈。 
瞋,8,Eastern Han-中論-慎所從,然猶不知所以失之，反,瞋,潰圍，斬將取旗，以明
瞋,6,Western Han-淮南子-覽冥訓,左操黃鉞，右秉白旄，,瞋,而撝之，曰：「余任天
瞋,6,Western Han-淮南子-主術訓,所關其辭。鞅鞈鐵鎧，,瞋,扼腕，其於以御兵刃，
瞋,6,Western Han-淮南子-人閒訓,，故可得而禽也。使狐,瞋,植睹，見必殺之勢，雉
瞋,6,Western Han-淮南子-泰族訓,而歌于易水之上，聞者,瞋,裂眥，發植穿冠。因以
瞋,16,Tang-意林-卷二,夜撮蚤，察毫末，晝出,瞋,而不見丘山，言殊性也
瞋,16,Tang-藝文類聚-卷一十七,自在吾，白髮臨欲拔，,瞋,號呼，何我之冤，何子
瞋,16,Tang-藝文類聚-卷三十五,犯其忌制，赴湯蹈火，,瞋,攘袂，或棄產而焚家，
瞋,16,Tang-藝文類聚-卷三十六,公曰：取彼金，公投鑣,瞋,。拂手而言曰：何子居
瞋,16,Tang-藝文類聚-卷五十八,，於是衛霍甘陳，虯髭,瞋,，心馳壟路，志飲河源
瞋,16,Tang-藝文類聚-卷六十,曼胡之纓，短後之衣，,瞋,而語難，相擊於前，此
瞋,16,Tang-藝文類聚-卷六十八,風晦冥，武王舉黃鉞。,瞋,而麾之曰：予在，天下
瞋,16,Tang-藝文類聚-卷七十四,群聚俱隕，力行唐突，,瞋,恚憤，覆局崩潰，項將
瞋,16,Tang-藝文類聚-卷八十四,將朱亥著猛獸圈中，亥,瞋,視之，眥裂血出，濺猛
瞋,16,Tang-藝文類聚-卷九十一,此中唐，利爪探玉除，,瞋,含火光，長翹驚風起，
瞋,16,Tang-藝文類聚-卷九十一,秦，排膺激怒，礡翅張,瞋,電鞭失焰，雷車折輪，
瞋,16,Tang-藝文類聚-卷九十三,曰：駿馬遇盜，秦君不,瞋,先傾美酒，翻畏傷人，
瞋,16,Tang-藝文類聚-卷九十五,脣，揚眉蹙額，若愁若,瞋,或長眠而抱把勒，或嚄
瞋,8,Eastern Han-越絕書-外傳記吳王占夢,光之劍，杖屈盧之矛，,瞋,謂范蠡曰：「子何不早
瞋,25,Qing-康熙字典-口部,》與䛭同。言也。一曰,瞋,。又《集韻》《類篇》
瞋,25,Qing-康熙字典-口部,》咄也。又《廣韻》啌,瞋,語出《聲譜》。又《集
瞋,25,Qing-康熙字典-口部,也。《王褒·洞簫賦》,瞋,㗅以紆鬱。《註》㖤，
瞋,25,Qing-康熙字典-口部,也。言氣之盛，㖤㗅類,瞋,也。  𠷋：《字彙》
瞋,25,Qing-康熙字典-口部,𠀤音䐜。《廣韻》本作,瞋,怒也。《集韻》本作謓
瞋,25,Qing-康熙字典-口部,聲尚如此，今俗則以爲,瞋,字矣。  嗕：《廣韻
瞋,25,Qing-康熙字典-大部,韻》𠀤許戒切，音譮。,瞋,聲。又《集韻》淺氏切
瞋,25,Qing-康熙字典-心部,廣韻》許極切，音𥈜。,瞋,貌。  㦢：《五音集
瞋,25,Qing-康熙字典-手部,祀志》燕齊之閒，方士,瞋,㧖𢯲。又《正韻》抑也
瞋,25,Qing-康熙字典-木部,：《集韻》惻人切，音,瞋,木名。又《集韻》鉏臻
瞋,25,Qing-康熙字典-木部,切。《馬融·長笛賦》,瞋,碨柍。《李善註》鬱積
瞋,25,Qing-康熙字典-目部,韻》丈忍切，𠀤音朕。,瞋,目貌。又《類篇》目之
瞋,25,Qing-康熙字典-目部,仰視也。《集韻》或作,瞋,。  𥄇：《集韻》與
瞋,25,Qing-康熙字典-目部,在。魏太祖顧指褚。褚,瞋,盻之，超不敢動。又勤
瞋,25,Qing-康熙字典-目部,。義同。《集韻》或作,瞋,  眓：《唐韻》《集
瞋,25,Qing-康熙字典-目部,《說文》之譌，以𥅜爲,瞋,文，非。互詳𥆏字註。
瞋,25,Qing-康熙字典-目部,方言》轉目也。吳楚謂,瞋,顧視亦曰眮。又《廣韻
瞋,25,Qing-康熙字典-目部,𥆏：《吳元滿·㴑原》,瞋,文作𥆏。詳後瞋字註。
瞋,25,Qing-康熙字典-目部,原》瞋重文作𥆏。詳後,瞋,註。○按《說文》瞋，
瞋,25,Qing-康熙字典-目部,瞋字註。○按《說文》,瞋,从目眞聲。祕書或从成
瞋,25,Qing-康熙字典-目部,誤从戍，非是，以𥅜與,瞋,義相牴牾也。又《字彙
瞋,25,Qing-康熙字典-目部,，𠀤音嗔。《說文》與,瞋,。又《廣韻》《集韻》
瞋,25,Qing-康熙字典-目部,，天去聲。視也。與䀖,瞋,同。《㴑原》或作𧡨。
瞋,25,Qing-康熙字典-目部,，音蕩。不明也。  ,瞋,《唐韻》昌眞切《集韻
瞋,25,Qing-康熙字典-目部,《史記·項羽紀》項王,瞋,叱之，樓煩目不敢視。
瞋,25,Qing-康熙字典-目部,略·苛吏傳》濟隂王思,瞋,無度。又《埤雅》禽經
瞋,25,Qing-康熙字典-目部,埤雅》禽經曰：鴨以怒,瞋,也。又《集韻》稱脂切
瞋,25,Qing-康熙字典-目部,。又亭年切，音田。眠,瞋,低目貌。又之刃切，音
瞋,25,Qing-康熙字典-目部,》眇視貌。又《類篇》,瞋,。又《廣韻》居悸切，
瞋,25,Qing-康熙字典-目部,彙音稱，訓怒目，義與,瞋,。○按瞋重文作𥆏攺从
瞋,25,Qing-康熙字典-目部,怒目，義與瞋同。○按,瞋,文作𥆏攺从盛，非。 
瞋,25,Qing-康熙字典-目部,韻》𠀤烏酷切，音沃。,瞋,也。又《正字通》古文
瞋,25,Qing-康熙字典-目部,，與覺義近。又音屋，,瞋,也。分爲二，非。○按
瞋,25,Qing-康熙字典-目部,，䁷訓目明也，且覺無,瞋,，似屬臆斷。  䁸：
瞋,25,Qing-康熙字典-目部,子·方言》梁益之閒，,瞋,曰矔，轉目顧視亦曰矔
瞋,25,Qing-康熙字典-石部,。又《馬融·長笛賦》,瞋,碨柍。《註》碨柍，聲
瞋,25,Qing-康熙字典-肉部,游士，莫不日夜扼腕，,瞋,切齒。《嵆康·琴賦》
瞋,25,Qing-康熙字典-肉部,《集韻》稱人切，𠀤音,瞋,《說文》起也。从肉，
瞋,25,Qing-康熙字典-肉部,漢·張耳陳餘傳》將軍,瞋,張膽。《註》張膽，言
瞋,25,Qing-康熙字典-艸部,。又《馬融·長笛賦》,瞋,碨柍。《註》皆衆聲鬱
瞋,25,Qing-康熙字典-言部,廣雅》言也。《廣韻》,瞋,也。又《字彙》䛭，直
瞋,25,Qing-康熙字典-言部,，𠀤亨去聲。或作啈。,瞋,也。又《集韻》虎梗切
瞋,25,Qing-康熙字典-言部,《集韻》稱人切，𠀤音,瞋,《說文》恚也。《廣雅
瞋,25,Qing-康熙字典-言部,怒也。《廣韻》與嗔、,瞋,。《集韻》或作㥲。又
瞋,25,Qing-康熙字典-辵部,作逞。又叶癡眞切，音,瞋,《張衡·思𤣥賦》遇九
瞋,25,Qing-康熙字典-門部,《韻補》叶稱人切，音,瞋,《𨻰琳·悼龜賦》探頤
瞋,25,Qing-紅樓夢-託內兄如海薦西賓　接外孫賈母惜孤女,波。雖怒時而似笑，即,瞋,而有情。項上金螭纓絡
瞋,4,Warring States-韓非子-守道,甘服於玉堂之中，而無,瞋,切齒傾取之患。人臣垂
瞋,4,Warring States-呂氏春秋-孝行覽,其孟賁也。中河，孟賁,瞋,而視船人，髮植，目裂
瞋,8,Eastern Han-前漢紀-高祖皇帝紀二,侯。能為我盡節否。苛,瞋,罵之。羽怒乃烹之。遂
瞋,8,Eastern Han-前漢紀-高祖皇帝紀三,之。羽大怒。即自出。,瞋,叱之。樓煩目不能視。
瞋,6,Western Han-方言-第六,眮，轉目也。梁益之間,瞋,曰矔，轉目顧視亦曰矔
瞋,4,Warring States-黃帝內經-靈樞經,交于目銳眥，陽氣盛則,瞋,，陰氣盛則瞑目。  
瞋,4,Warring States-黃帝內經-靈樞經,大逆，上滿於胸中，憤,瞋,息，大氣逆上，喘喝坐
瞋,8,Eastern Han-風俗通義-聲音,。後為羽聲慷慨，而索,瞋,，髮盡上指冠。荊軻入
瞋,8,Eastern Han-論衡-書虛,來。」薪者投鎌於地，,瞋,拂手而言曰：「何子居
瞋,8,Eastern Han-論衡-感虛,左操黃鉞，右執白旄，,瞋,而麾之曰：『余在，天
瞋,8,Eastern Han-論衡-感虛,不奉天令，求索己過，,瞋,言曰：「余在，天下誰
瞋,8,Eastern Han-論衡-感虛,？父母怒，子不改過，,瞋,大言，父母肯貰之乎？
瞋,8,Eastern Han-論衡-感虛,自然，是亦無知，不為,瞋,麾之故止。夫風猶雨也
瞋,8,Eastern Han-論衡-感虛,。夫風猶雨也，使武王,瞋,以旄麾雨而止之乎？武
瞋,24,Ming-三國演義-李傕郭汜大交兵，楊奉董承雙救駕,必推讓。」張飛聽了，,瞋,大叱曰：「我哥哥是金
瞋,24,Ming-三國演義-曹丕乘亂納甄氏，郭嘉遺計定遼東,曰：「願鋪坐席。」康,瞋,言曰：「汝二人之頭，
瞋,16,Tang-通典-職官六,，待罪朝堂。今楚客等,瞋,作色，稱以忠鯁被誣。
瞋,16,Tang-通典-刑法八,刺史羅剎暴，司馬蝮蛇,瞋,長史含笑判，清河生喫
瞋,25,Qing-全唐詩-卷二百二十三,我能泛中流，搪突鼉獺,瞋,長年已省柁，慰此貞良
瞋,25,Qing-全唐詩-卷二百八十九,竇牟  直用天才眾卻,瞋,應欺李杜久為塵。  
瞋,25,Qing-全唐詩-卷三百五十五,槭。  適逢修蛇見，,瞋,光激射。如嚴三清居，
瞋,25,Qing-全唐詩-卷三百七十五,閑。求閑未得閒，眾誚,瞋,F々。  *遊城南韓
瞋,25,Qing-全唐詩-卷四百二十七,皆可測，不測人間笑是,瞋,  *秦吉了－哀冤民
瞋,25,Qing-全唐詩-卷五百六十一,嬌淚半垂珠不破，恨君,瞋,後庭花。  取次衣裳
瞋,25,Qing-全唐詩-卷七百六十二,陰上竹樓。  對面雷,瞋,，當街雨趁人。  春
瞋,25,Qing-全唐詩-卷八百,願君兮見察，妾死兮何,瞋,  *制履贈楊達  
瞋,25,Qing-全唐詩-卷八百零六,術，不貪為上謨。  ,瞋,心中火，能燒功德林。
瞋,25,Qing-全唐詩-卷八百零六,十二部。慈悲如野鹿，,瞋,似家狗。  家狗趁不
瞋,25,Qing-全唐詩-卷八百零六,  數年無效驗，癡意,瞋,鬱。獵師披袈裟，元非
瞋,25,Qing-全唐詩-卷八百零六,聰明無益當。牛頭努目,瞋,出去始時晌。  擇佛
瞋,25,Qing-全唐詩-卷八百零六, 順情生喜悅，逆意多,瞋,。但看木傀儡，弄了一
瞋,25,Qing-全唐詩-卷八百零七,見佛不解禮，睹僧倍生,瞋,五逆十惡輩，三毒以為
瞋,25,Qing-全唐詩-卷八百一十四,夕陽田。急兔投深草，,瞋,下半天。  野人盈邸
瞋,25,Qing-全唐詩-卷八百五十二,下調無人睬，高心又被,瞋,不知時俗意，教我若為
瞋,6,Western Han-韓詩外傳-卷九,專意自是，言人之非，,瞋,搤腕，疾言噴噴，口沸
瞋,4,Warring States-莊子-外篇,夜撮蚤，察毫末，晝出,瞋,而不見丘山，言殊性也
瞋,4,Warring States-莊子-雜篇,大怒，兩展其足，案劍,瞋,，聲如乳虎，曰：「丘
瞋,4,Warring States-莊子-雜篇,曼胡之纓，短後之衣，,瞋,而語難，相擊於前，上
盱,8,Eastern Han-說文解字-卷五,目从㢟，㢟亦聲。  ,盱,張目也。从目于聲。一
盱,8,Eastern Han-說文解字-卷五,。一曰朝鮮謂盧童子曰,盱,  睘：目驚視也。从
盱,18,Northern Song-廣韻-上平聲, 隳：俗。  眭：眭,盱,皃又息爲切盱音吁。 
盱,18,Northern Song-廣韻-上平聲,眭：眭盱健皃又息爲切,盱,吁。  觿：角錐童子
盱,18,Northern Song-廣韻-上平聲,婎：上同。  睢：睢,盱,皃。  眭：眭盱健皃
盱,18,Northern Song-廣韻-上平聲,睢盱視皃。  眭：眭,盱,皃。  𢊄：𢊄姿𢊄。
盱,18,Northern Song-廣韻-上平聲,苑。又音胎。  眙：,盱,縣在楚州。  瓵：《
盱,18,Northern Song-廣韻-上平聲,。  㽳：病也。  ,盱,舉目又盱眙縣在楚州。
盱,18,Northern Song-廣韻-上平聲,病也。  盱：舉目又,盱,縣在楚州。  𧙆：大
盱,24,Ming-西遊記-諸神遭毒手　彌勒縛妖魔,。這枝兵也在南贍部洲,盱,山蠙城，即今泗洲是也
盱,24,Ming-西遊記-諸神遭毒手　彌勒縛妖魔,斗雲，躲離怪處，直奔,盱,山，不一日早到。細觀
盱,8,Eastern Han-白虎通德論-卷六,武王望羊，是謂攝揚，,盱,陳兵，天下富昌。周公
盱,18,Northern Song-太平廣記-女仙四, *梁母  梁母者，,盱,人也，寡居無子，舍逆
盱,18,Northern Song-太平廣記-方士三,異，皆挾利兵，瞻顧睢,盱,言語兇謾。假令揮刃，
盱,18,Northern Song-太平廣記-徵應二帝王休徵,普光時。將祈禮者，睢,盱,視，如病風狂，云：「
盱,18,Northern Song-太平廣記-徵應十一人臣咎徵,者，或緋或綠，倏閃睢,盱,莫知何物。左右大駭，
盱,18,Northern Song-太平廣記-定數十三,。」大明之神，忽揚目,盱,。咄嗟長歎而謂衆賓曰
盱,18,Northern Song-太平廣記-豪俠三,某與公風馬牛耳。不意,盱,相遇，實慕君子。何至
盱,18,Northern Song-太平廣記-神四,乘軺車，駕以黃羊，睢,盱,惡。溫即夢見神怒曰：
盱,4,Warring States-荀子-非十二子,然，瞿瞿然，盡盡然，,盱,然；酒食聲色之中，則
盱,4,Warring States-荀子-非十二子,，瞿瞿然，盡盡然，盱,盱,；酒食聲色之中，則瞞
盱,11,Western Jin-三國志-蜀書二,來攻先主，先主拒之於,盱,、淮陰。曹公表先主為
盱,11,Western Jin-三國志-蜀書十二,葉，陰精應於商時，陽,盱,而洪灾息，桑林禱而甘
盱,11,Western Jin-三國志-蜀書十二,：禹為水，以身請於陽,盱,河，湯苦旱，以身禱於
盱,11,Western Jin-三國志-吳書一,書除堅鹽瀆丞，數歲徙,盱,丞，又徙下邳丞。江表
盱,6,Western Han-史記-本紀,國，封五縣，與懷王都,盱,。項梁自號為武信君。
盱,6,Western Han-史記-本紀,破於定陶，懷王恐，從,盱,之彭城，并項羽、呂臣
盱,6,Western Han-史記-本紀,聞龍且軍破，則恐，使,盱,人武涉往說淮陰侯。淮
盱,6,Western Han-史記-本紀,後懷王孫心為楚王，治,盱,。項梁號武信君。居數
盱,6,Western Han-史記-本紀,王見項梁軍破，恐，徙,盱,都彭城，并呂臣、項羽
盱,6,Western Han-史記-本紀,聞龍且軍破，則恐，使,盱,人武涉往說韓信。韓信
盱,6,Western Han-史記-列傳,已亡龍且，項王恐，使,盱,人武涉往說齊王信曰：
盱,6,Western Han-新書-卷三,也，苟家富財足，隱机,盱,而為天子耳。唯告罪昆
盱,6,Western Han-新書-卷四,一國聞之者見之者，希,盱,告，人人忣忣，唯恐其
盱,6,Western Han-新書-卷四,耳。一國聞者見者，希,盱,欲，人人忣忣，惟恐其
盱,18,Northern Song-太平御覽-天部十五,《宋元嘉起居注》曰：,盱,民王彭先丁母艱，居喪
盱,18,Northern Song-太平御覽-地部六,，精神似不足，眼目睢,盱,門人相謂曰：「師修行
盱,18,Northern Song-太平御覽-地部八,山。  都梁山  《,盱,圖經》曰：都梁山周回
盱,18,Northern Song-太平御覽-地部八,遂廢。  斗山  《,盱,圖經》曰：斗山周回二
盱,18,Northern Song-太平御覽-地部八,山。  臺子山  《,盱,圖經》曰：臺子山周回
盱,18,Northern Song-太平御覽-地部八,是。  長圍山  《,盱,圖經》曰：長圍山周回
盱,18,Northern Song-太平御覽-地部三十五,約《宋書》曰：王彭，,盱,人，少喪母，元嘉初，
盱,18,Northern Song-太平御覽-皇王部十一,為楚上柱國，與懷王都,盱,。秦滅，尊懷王為義帝
盱,18,Northern Song-太平御覽-皇王部二十七,孔子。次于彭城，遂趨,盱,吁眙。音怡十二月，車
盱,18,Northern Song-太平御覽-皇王部二十七,，作筏數萬而濟。義隆,盱,守將臧質閉門距守。將
盱,18,Northern Song-太平御覽-皇王部二十七,軍胡崇之等率眾二萬援,盱,。燕王譚大破之，梟崇
盱,18,Northern Song-太平御覽-皇王部三十二,自長白山寇掠諸郡，至,盱,，有眾十余萬。世充以
盱,18,Northern Song-太平御覽-偏霸部一,袁術來攻，先主拒之於,盱,、淮陰。曹公表先主為
盱,18,Northern Song-太平御覽-偏霸部七,破之。鼓行濟淮，屯于,盱,，朝廷大震。襄方軌引
盱,18,Northern Song-太平御覽-偏霸部十八,丑，南北兗、晉三州及,盱,、山陽、陽平、馬頭、
盱,18,Northern Song-太平御覽-州郡部六,。楚漢之際，楚懷王自,盱,徙都之；后項羽徙懷王
盱,18,Northern Song-太平御覽-州郡部十五,上。  《漢志》曰：,盱,，屬臨淮郡。都尉治。
盱,18,Northern Song-太平御覽-州郡部十五,  《南兗州記》曰：,盱,，本春秋時善道地。 
盱,18,Northern Song-太平御覽-州郡部十五,懷王孫心為楚懷王，都,盱,。  《南兗州記》曰
盱,18,Northern Song-太平御覽-職官部六十七,書除堅鹽瀆丞，數歲徙,盱,丞，又徙下邳丞。又曰
盱,18,Northern Song-太平御覽-兵部二十五,賊孟讓，眾號十萬，屯,盱,。煬帝遣王充保都梁山
盱,18,Northern Song-太平御覽-兵部三十二,：卞壸字望之，子眕及,盱,沒陣，母撫二子尸哭曰
盱,18,Northern Song-太平御覽-人事部五十一,樂安、任昉，見一善則,盱,扼腕，遇一才則揚眉抵
盱,18,Northern Song-太平御覽-人事部七十五,為義帝，從民望也。都,盱,，梁自號武信君。師次
盱,18,Northern Song-太平御覽-宗親部一,，遂單騎赴難，二子眕,盱,之俱歿。母裴氏撫尸而
盱,18,Northern Song-太平御覽-禮儀部二十三,文之物。以給線縷，著,盱,綦握之屬也。青與赤謂
盱,18,Northern Song-太平御覽-服用部十一,老子，老子曰：「睢睢,盱,，而誰與居？夫太白若
盱,18,Northern Song-太平御覽-服用部十一,子，老子曰：「睢睢盱,盱,而誰與居？夫太白若辱
盱,18,Northern Song-太平御覽-咎徵部五,文帝玄嘉三十年五月，,盱,雨雹，大如雞卵。明年
盱,18,Northern Song-太平御覽-獸部二十二,店切。而總贛，音貢豁,盱,以頊𨢘。生深山之茂林
盱,7,Xin-漢書-紀,臣引兵而東，徙懷王自,盱,都彭城。呂臣軍彭城東
盱,7,Xin-漢書-紀,為廣宗王，江都易王孫,盱,侯宮為廣川王，廣川惠
盱,7,Xin-漢書-志,九：徐，取慮，淮浦，,盱,，厹猶，僮，射陽，開
盱,7,Xin-漢書-志,與女方秉菅兮。」「恂,盱,樂，惟士與女，伊其相
盱,7,Xin-漢書-傳,國，封五縣。與懷王都,盱,。梁自號武信君，引兵
盱,7,Xin-漢書-傳,以亡龍且，項王恐，使,盱,人武涉往說信曰：「足
盱,7,Xin-漢書-傳,政，興滅繼絕，立建弟,盱,侯子宮為廣陵王，奉易
盱,7,Xin-漢書-傳,年不成而後反故，又廣,盱,表，發人冢墓，斷截骸
盱,7,Xin-漢書-傳,見之明，奮亡前之威，,盱,厲色，振揚武怒，乘其
