query,dynFromId,meta,left,keyword,right
瞑,8,Eastern Han-論衡-死偽,，宣子撫之早，故目不,瞑,口不闓。少久氣衰，懷
瞑,8,Eastern Han-論衡-死偽,氣衰，懷子撫之，故目,瞑,受唅。此自荀偃之病，
瞑,8,Eastern Han-論衡-死偽,而各有所恨，必有目不,瞑,為有所恨，夫天下之人
瞑,8,Eastern Han-論衡-死偽,恨，夫天下之人死皆不,瞑,，且死者精魂消索，不
瞑,8,Eastern Han-論衡-死偽,形絕，安能復入身中，,瞑,闓口乎？能入身中以尸
瞑,8,Eastern Han-論衡-死偽,死。謚之曰「靈」，不,瞑,曰「成」，乃瞑。夫為
瞑,8,Eastern Han-論衡-死偽,，不瞑；曰「成」，乃,瞑,夫為「靈」不瞑，為「
瞑,8,Eastern Han-論衡-死偽,，乃瞑。夫為「靈」不,瞑,為「成」乃瞑，成王有
瞑,8,Eastern Han-論衡-死偽,靈」不瞑，為「成」乃,瞑,成王有知之效也。謚之
瞑,8,Eastern Han-論衡-死偽,「靈」，心恨，故目不,瞑,更謚曰「成」，心喜乃
瞑,8,Eastern Han-論衡-死偽,更謚曰「成」，心喜乃,瞑,精神聞人之議，見人變
瞑,8,Eastern Han-論衡-死偽,見人變易其謚，故喜目,瞑,本不病目，人不撫慰，
瞑,8,Eastern Han-論衡-死偽,」。少久氣衰，目適欲,瞑,連更曰「成」。目之視
瞑,8,Eastern Han-論衡-死偽,連更曰「成」。目之視,瞑,與謚之為「靈」，偶應
瞑,8,Eastern Han-論衡-死偽,。時人見其應「成」乃,瞑,則謂成王之魂有所知，
瞑,8,Eastern Han-論衡-死偽,之魂有所知，則宜終不,瞑,。何則？太子殺己，大
瞑,8,Eastern Han-論衡-死偽,其尸未歛之時，未皆不,瞑,。豈世之死君不惡，而
瞑,8,Eastern Han-論衡-死偽,何其為「靈」者眾、不,瞑,寡也？  鄭伯有貪愎
瞑,24,Ming-三國演義-劉皇叔北海救孔融，呂溫侯濮陽破曹操,君若捨我而去，我死不,瞑,矣！」雲長曰：「既承
瞑,24,Ming-三國演義-陶恭祖三讓徐州，曹孟德大戰呂布,取徐州牌印，老夫死亦,瞑,矣！」玄德曰：「君有
瞑,24,Ming-三國演義-兄逼弟曹植賦詩，姪陷叔劉封伏法,存其性命。吾至九泉亦,瞑,也。」丕曰：「兒亦深
瞑,24,Ming-三國演義-曹丕廢帝篡炎劉，漢王正位續大統,數次，孔明只推病重，,瞑,不答。漢中王再三請問
瞑,24,Ming-三國演義-武鄉侯四番用計，南蠻王五次遭擒,「吾今誤中詭計，死不,瞑,！」孔明叱武士推出斬
瞑,24,Ming-三國演義-祭瀘水漢相班師，伐中原武侯上表,同心輔朕之子，朕死亦,瞑,矣！」言訖，墮淚而薨
瞑,9,Han-難經-經脈診候,氣俱絕者，則目眩轉目,瞑,目瞑者，為失志；失志
瞑,9,Han-難經-經脈診候,者，則目眩轉目瞑。目,瞑,，為失志；失志者，則
瞑,9,Han-難經-經脈診候,者，則志先死，死即目,瞑,。  陽氣俱絕者，則
瞑,24,Ming-金瓶梅-來旺兒遞解徐州　宋蕙蓮含羞自縊,眇，已赴望鄉台；星眼,瞑,，屍猶橫地下。不知精
瞑,24,Ming-金瓶梅-來旺兒遞解徐州　宋蕙蓮含羞自縊,，已赴望鄉台；星眼瞑,瞑,屍猶橫地下。不知精爽
瞑,24,Ming-金瓶梅-李瓶兒私語翡翠軒　潘金蓮醉鬧葡萄架,子折在裡面。婦人則目,瞑,息，微有聲嘶，舌尖冰
瞑,24,Ming-金瓶梅-西門慶乘醉燒陰戶　李瓶兒帶病宴重陽,百度。婦人禁受不的，,瞑,顫聲，沒口子叫：「達
瞑,24,Ming-金瓶梅-潘道士法遣黃巾士　西門慶大哭李瓶兒,！」良久，只見潘道士,瞑,變神，端坐於位上，據
瞑,16,Tang-通典-食貨一,樂土之慮。故人之為言,瞑,，謂瞑瞑無所知。猶群
瞑,16,Tang-通典-食貨一,。故人之為言瞑也，謂,瞑,無所知。猶群羊聚畜，
瞑,16,Tang-通典-食貨一,故人之為言瞑也，謂瞑,瞑,所知。猶群羊聚畜，須
瞑,16,Tang-通典-食貨十二,之士而能達也。民者，,瞑,，可使由之，不可使因
瞑,16,Tang-通典-兵十五,雷不及掩耳，疾電不及,瞑,」也。指嚮分眾，因敵
瞑,8,Eastern Han-文子-道原,鈍而無刃，行蹎蹎。視,瞑,，立井而飲，耕田而食
瞑,8,Eastern Han-文子-道原,而無刃，行蹎蹎。視瞑,瞑,立井而飲，耕田而食，
瞑,8,Eastern Han-文子-精誠,其民童蒙不知西東，視,瞑,，行蹎蹎，侗然自得，
瞑,8,Eastern Han-文子-精誠,民童蒙不知西東，視瞑,瞑,行蹎蹎，侗然自得，莫
瞑,25,Qing-全唐詩-卷二十三,棲。彈弦寫恨意不盡，,瞑,歸黃泥。  *琴曲歌
瞑,25,Qing-全唐詩-卷一百六十二,棲。彈弦寫恨意不盡，,瞑,歸黃泥。  *上雲樂
瞑,25,Qing-全唐詩-卷三百四十二,歎倦塵囂。  惟彼顛,瞑,，去公豈不遼。為仁朝
瞑,25,Qing-全唐詩-卷三百九十一,美人截黃綬，脫落纓裾,瞑,酒。  還家白筆未上
瞑,25,Qing-全唐詩-卷三百九十四,，桐竹羅花床。眼逐春,瞑,，粉隨淚色黃。  王
瞑,25,Qing-全唐詩-卷四百零三,，年應四十無。遙聞不,瞑,，非是不憐吳。  雕
瞑,25,Qing-全唐詩-卷五百四十,，此舉太無名。  誰,瞑,冤目，寧吞欲絕聲。近
瞑,25,Qing-全唐詩-卷五百四十一,俁俁行忘止，鰥鰥臥不,瞑,身應瘠于魯，淚欲溢為
瞑,25,Qing-全唐詩-卷五百四十三,帶夕陽。唯應無月夜，,瞑,見他方。  *龍翔寺
瞑,25,Qing-全唐詩-卷五百四十三,夏臘高。寒堂坐風雨，,瞑,尚波濤。  *西山寒
瞑,25,Qing-全唐詩-卷六百一十,，古經貝多紙。老僧方,瞑,，見客還強起。  指
瞑,25,Qing-全唐詩-卷六百二十六,心還爽，遠憶幽期目剩,瞑,見買扁舟束真誥，手披
瞑,25,Qing-全唐詩-卷六百四十三,冷上孤峰。  窮理多,瞑,，含毫靜倚松。終篇渾
瞑,25,Qing-全唐詩-卷六百四十五,流。  憑欄疏磬盡，,瞑,遠雲收。幾句出人意，
瞑,25,Qing-全唐詩-卷七百三十九,陰風窣窣吹紙錢，妖巫,瞑,傳神言。  與君降福
瞑,25,Qing-全唐詩-卷七百四十八,樹，雲暗暮秋燈。  ,瞑,忘塵慮，談空入上乘。
瞑,25,Qing-全唐詩-卷七百四十九,  五更初起掃松堂，,瞑,先焚一炷香。  念徹
瞑,25,Qing-全唐詩-卷七百七十六,設安所榮。  石人徒,瞑,，表柱燒無聲。試讀碑
瞑,25,Qing-全唐詩-卷八百一十四,南。  倚身松入漢，,瞑,月離潭。此境堪長往，
瞑,4,Warring States-管子-小問,而少實」，桓公不說，,瞑,而視祝鳧已疪。祝鳧已
瞑,6,Western Han-春秋繁露-深察名號,。士者，事也；民者，,瞑,。士不及化，可使守事
瞑,6,Western Han-春秋繁露-深察名號,不成德。民之號，取之,瞑,。使性而已善，則何故
瞑,6,Western Han-春秋繁露-深察名號,使性而已善，則何故以,瞑,號？以者言，弗扶將，
瞑,6,Western Han-春秋繁露-深察名號,？性有似目，目臥幽而,瞑,待覺而後見。當其未覺
瞑,6,Western Han-春秋繁露-深察名號,有其質而未能覺，譬如,瞑,待覺，教之然後善。當
瞑,6,Western Han-春秋繁露-深察名號,不可說服力善，與目之,瞑,覺，一概之比也。靜心
瞑,6,Western Han-春秋繁露-深察名號,之，其言可見矣。性而,瞑,未覺；天所為也。效天
瞑,6,Western Han-春秋繁露-深察名號,之民。民之為言，固猶,瞑,，隨其名號以入其理，
瞑,6,Western Han-春秋繁露-深察名號,之性情。性情相與為一,瞑,情亦性也。謂性已善，
瞑,6,Western Han-春秋繁露-人副天數,，副四時數也；乍視乍,瞑,副晝夜也；乍剛乍柔，
瞑,4,Warring States-莊子-內篇,，倚樹而吟，據槁梧而,瞑,天選子之形，子以堅白
瞑,4,Warring States-莊子-外篇,龍吉。神農隱几闔戶晝,瞑,婀荷甘日中奓戶而入，
矉,8,Eastern Han-說文解字-卷五,動也。从目閏聲。  ,矉,恨張目也。从目賓聲。
矉,8,Eastern Han-說文解字-卷五,。《詩》曰：「國步斯,矉,」  眢：目無明也。
矉,18,Northern Song-廣韻-上平聲,：鑌鐵爲刀甚利。  ,矉,《說文》曰：恨張目也
矉,18,Northern Song-太平御覽-樂部九,屬，往見文王。文王為,矉,反目者，紂之好色也；
矉,25,Qing-康熙字典-口部,，愁眉柳葉顰。又通作,矉,《莊子·天運篇》西施
矉,25,Qing-康熙字典-口部,·天運篇》西施病心而,矉,《註》蹙額曰矉。《李
矉,25,Qing-康熙字典-口部,心而矉。《註》蹙額曰,矉,《李白詩》蛾眉不可妒
矉,25,Qing-康熙字典-口部,蛾眉不可妒，况乃效其,矉,又借作頻。《孟子》已
矉,25,Qing-康熙字典-目部,或作𥌂。通作臱。  ,矉,《唐韻》符眞切《集韻
矉,25,Qing-康熙字典-目部,也。引《詩》：國步斯,矉,今詩作頻。又《正字通
矉,25,Qing-康熙字典-目部,天運篇》西施病心，而,矉,里。又《廣韻》必鄰切
矉,25,Qing-康熙字典-頁部,。《莊子·至樂篇》深,矉,頞。又《博雅》䪼也。
矉,25,Qing-康熙字典-頁部,》謂頻蹙之貌。又通作,矉,《莊子·天運篇》西施
矉,25,Qing-康熙字典-頁部,·天運篇》西施病心而,矉,里，其里之醜人見而美
矉,25,Qing-康熙字典-頁部,見而美之，歸亦捧心而,矉,里。《李白詩》蛾眉不
矉,25,Qing-康熙字典-頁部,蛾眉不可學，况乃效其,矉,亦作嚬。考證：〔《玉
矉,4,Warring States-莊子-外篇,周公也。故西施病心而,矉,里，其里之醜人見而美
矉,4,Warring States-莊子-外篇,見而美之，歸亦捧心而,矉,里。其里之富人見之，
矉,4,Warring States-莊子-外篇,挈妻子而去之走。彼知,矉,而不知矉之所以美。惜
矉,4,Warring States-莊子-外篇,之走。彼知矉美而不知,矉,所以美。惜乎！而夫子
矉,4,Warring States-莊子-外篇,，子欲之乎？」髑髏深,矉,頞曰：「吾安能棄南面
盷,18,Northern Song-廣韻-下平聲,：《說文》很也。  ,盷,目大皃。  胘：牛百
盷,8,Eastern Han-大戴禮記-本命,言、不能化。三月而徹,盷,然後能有見；八月生齒
盷,25,Qing-康熙字典-目部,》皆言形狀乖戾。  ,盷,《廣韻》亭年切，音田
盷,25,Qing-康熙字典-目部,本命篇》人生三月而徹,盷,然後能有見。《註》盷
盷,25,Qing-康熙字典-目部,，然後能有見。《註》,盷,精也，轉視貌。又《廣
盷,25,Qing-康熙字典-目部,韻》𠀤胡涓切，音懸。,盷,，大目也。又《集韻》
盷,25,Qing-康熙字典-目部,，𠀤音珉。視貌。或作,盷,𥄐。  𥄐：《字彙》
眩,4,Warring States-戰國策-秦策,之王不如鄭賈之智也，,眩,名，不知其實也。」 
眩,4,Warring States-戰國策-魏策,其辭，牽其說，惡得無,眩,？臣聞積羽沉舟，群輕
眩,4,Warring States-戰國策-燕策,右既前斬荊軻，秦王目,眩,久。而論功賞群臣及當
眩,8,Eastern Han-說文解字-卷五,瞥者。从目瞏聲。  ,眩,目無常主也。从目玄聲
眩,8,Eastern Han-說文解字-卷八,若《周書》「若藥不眄,眩,。  寬：屋寬大也。
眩,18,Northern Song-廣韻-上平聲, 詢：咨也。  眴：,眩,又音舜。  峋：嶙峋
眩,18,Northern Song-廣韻-上平聲,黎靬國名在西域其人善,眩,。又犍、看二音。  
眩,18,Northern Song-廣韻-下平聲, 懸：俗今通用。  ,眩,亂也。又胡練切。  
眩,18,Northern Song-廣韻-去聲, 𢂻：枕巾。  䀼：,眩,。  𦙍：繼也，嗣也
眩,18,Northern Song-廣韻-去聲,。  袨：好衣。  ,眩,瞑眩書曰若藥弗瞑眩厥
眩,18,Northern Song-廣韻-去聲,袨：好衣。  眩：瞑,眩,曰若藥弗瞑眩厥疾弗瘳
眩,18,Northern Song-廣韻-去聲,眩：瞑眩書曰若藥弗瞑,眩,疾弗瘳。  炫：明也
眩,18,Northern Song-廣韻-去聲,麵：上同。  瞑：瞑,眩,  眄：斜視。  㴐
眩,24,Ming-西遊記-蛇盤山諸神暗佑　鷹愁澗意馬收韁,夜雨聞幽谷，彩發朝霞,眩,空。千仞浪飛噴碎玉，
眩,8,Eastern Han-申鑒-雜言上,殷高宗能葺其德，藥瞑,眩,瘳疾；衛武箴戒於朝；
眩,18,Northern Song-太平廣記-神仙二十八,迥拔。石徑危峻。契虛,眩,不敢登。捀子曰：「仙
眩,18,Northern Song-太平廣記-女仙二,。夫人亦以鬼怪虎狼及,眩,衆變試之。明生神情澄
眩,18,Northern Song-太平廣記-異僧九, 禪師既到天堂，天光,眩,，開不能得。天帝曰：
眩,18,Northern Song-太平廣記-異僧九,昉遽念之，於是目開不,眩,而人身卑小，仰視天形
眩,18,Northern Song-太平廣記-報應十二崇經像,安居依言投符，矇然如,眩,乃是其家庭中也。正聞
眩,18,Northern Song-太平廣記-定數十四婚姻,。及嫁之夕，忽得疾昏,眩,若將不救。時殷在京師
眩,18,Northern Song-太平廣記-貢舉七,己有。文煥曰。藥不瞑,眩,厥疾弗瘳。璨甚銜之。
眩,18,Northern Song-太平廣記-貢舉七,。璨每遇之曰。藥不瞑,眩,厥疾弗瘳。出《摭言》
眩,18,Northern Song-太平廣記-儒行,識。不過為土龍乞雨，,眩,將來。其於立身之道何
眩,18,Northern Song-太平廣記-醫一,秦鳴鶴  唐高宗苦風,眩,頭目不能視。召侍醫秦
眩,18,Northern Song-太平廣記-奢侈二,街巷，晶光耀日，觀者,眩,目。時有中貴人，買酒
眩,18,Northern Song-太平廣記-嘲誚三,門，百僚備列，鏗忽風,眩,倒。鏗肥而短，景詠之
眩,18,Northern Song-太平廣記-妖妄二,乖露，乃是得藥於人，,眩,賣弄，為元戎殺之。出
眩,18,Northern Song-太平廣記-神十一,輕薄無檢，又為物色夸,眩,意甚悅之。坐定，許問
眩,18,Northern Song-太平廣記-鬼二十三,聲。衆樂齊奏。心神已,眩,爵行無數，吾始忘之。
眩,18,Northern Song-太平廣記-鬼三十六,而止之。一旦，暴得風,眩,方臥於廡下，忽有田父
眩,18,Northern Song-太平廣記-精怪一,詞辨如此。豈非妖魅為,眩,乎。試與諸公取劒備之
眩,18,Northern Song-太平廣記-精怪三,火色。相馳逐，而目光,眩,，砉剨有聲。逡巡間，
眩,18,Northern Song-太平廣記-再生八,死不得，一宿二日，眼,眩,悶。有赤幘吏來，捉數
眩,18,Northern Song-太平廣記-再生十一,不記間數。珠簾翠幕，,眩,人目。樓上悉是婦人，
眩,18,Northern Song-太平廣記-寶五雜寳下,，而光彩動搖。觀者皆,眩,目，上亦不為之貴。一
眩,18,Northern Song-太平廣記-草木九,食。此諸公多患風痹及,眩,，皆得愈。但不能大得
眩,18,Northern Song-太平廣記-狐二,舍。婢等並妖媚蠱冶。,眩,丈夫。往來者多經過焉
眩,18,Northern Song-太平廣記-狐二,日即欲開瘞，恐李郎被,眩,，不見信。今宜開視，
眩,18,Northern Song-太平廣記-狐六,相視大笑。同行者更相,眩,，稍已狎暱。鄭子隨之
眩,18,Northern Song-太平廣記-蛇二,以樵刀畫腹，得出之。,眩,迷悶，久之方悟。其人
眩,6,Western Han-揚子法言-問道卷第四,，圍棋、擊劍、反目、,眩,，亦皆自然也。由其大
眩,6,Western Han-揚子法言-問明卷第六,敢問大聰明。」曰：「,眩,乎，惟天為聰，惟天為
眩,6,Western Han-揚子法言-問明卷第六,問大聰明。」曰：「眩,眩,，惟天為聰，惟天為明
眩,4,Warring States-禮記-中庸,昆弟不怨，敬大臣則不,眩,體群臣則士之報禮重，
眩,4,Warring States-荀子-正名,誻然而沸，彼誘其名，,眩,辭，而無深於其志義者
眩,11,Western Jin-三國志-魏書一,無幸勝。知人善察，難,眩,偽，拔于禁、樂進於行
眩,11,Western Jin-三國志-魏書十二,見融浮豔，好作變異，,眩,誑詐，不復察其亂俗也
眩,11,Western Jin-三國志-魏書二十二,失之辨哉？使百代之君,眩,奢儉之中，何之由矣。
眩,11,Western Jin-三國志-魏書二十八,人中食，覺而吐之，瞑,眩,數日。或曰：『何不向
眩,11,Western Jin-三國志-魏書二十九,畢歸，行數里，昕卒頭,眩,車，人扶將還，載歸家
眩,11,Western Jin-三國志-魏書二十九,苦頭風，每發，心亂目,眩,佗針鬲，隨手而差。佗
眩,11,Western Jin-三國志-魏書二十九,，七日愈。又有人苦頭,眩,頭不得舉，目不得視，
眩,11,Western Jin-三國志-魏書二十九,向惑於鴻寶之說，君游,眩,子政之言，古今愚謬，
眩,11,Western Jin-三國志-魏書二十九,者若秋風之落葉。聽者,眩,，不達其義，言者收聲
眩,11,Western Jin-三國志-蜀書七,賤賢也。宜加敬重，以,眩,近，追昔燕王之待郭隗
眩,11,Western Jin-三國志-蜀書七,之士將何以禮之？正務,眩,之術，違貴尚之風，譬
眩,11,Western Jin-三國志-吳書八,離則有釁，巧辯緣間，,眩,小忠，戀於恩愛，賢愚
眩,11,Western Jin-三國志-吳書十六,亂，民力盡於奢侈，目,眩,美色，志濁於財寶，邪
眩,11,Western Jin-三國志-吳書十六,臨阼以來，游戲後宮，,眩,婦女，乃令庶事多曠，
眩,11,Western Jin-三國志-吳書二十,辭，黜善士以逆諫臣，,眩,毀譽之實，沈淪近習之
眩,13,Jin-抱朴子-內篇,在立亡，變形易貌，誑,眩,庶，糾合群愚，進不以
眩,13,Jin-抱朴子-內篇,食。此諸公多患風痺及,眩,，皆得愈，但不能大得
眩,13,Jin-抱朴子-內篇,其精悉能假託人形，以,眩,人目而常試人，唯不能
眩,13,Jin-抱朴子-內篇,色希聲飾其虛妄，足以,眩,晚學，而敢為大言。乃
眩,13,Jin-抱朴子-外篇,鑒所為寒心，匠人之所,眩,矣。  「又欲推短才
眩,13,Jin-抱朴子-外篇,之會，暫觀一睹，無所,眩,，探其潛生之心計，定
眩,13,Jin-抱朴子-外篇,，則同之游夏。是以世,眩,實，而大亂滋甚也。若
眩,13,Jin-抱朴子-外篇,藏禍心，文致太平，誑,眩,野，貺遺外域，使送瑞
眩,6,Western Han-史記-列傳,其辯而牽其說，豈得無,眩,。  「臣聞之，積羽
眩,6,Western Han-史記-列傳, 中庶子聞扁鵲言，目,眩,而不瞚，舌撟然而不下
眩,6,Western Han-史記-列傳,屈虹而為綢。紅杳渺以,眩,兮，猋風涌而雲浮。駕
眩,6,Western Han-史記-列傳,兮，上寥廓而無天。視,眩,而無見兮，聽惝恍而無
眩,6,Western Han-史記-列傳,屬之，以為外國。國善,眩,安息長老傳聞條枝有弱
眩,6,Western Han-史記-列傳,大，以大鳥卵及黎軒善,眩,獻于漢。及宛西小國驩
眩,6,Western Han-史記-列傳,廣大，傾駭之。及加其,眩,之工，而觳抵奇戲歲增
眩,19,Southern Song-四書章句集注-中庸章句,昆弟不怨，敬大臣則不,眩,體群臣則士之報禮重，
眩,19,Southern Song-四書章句集注-中庸章句,不惑，謂不疑於理。不,眩,謂不迷於事。敬大臣則
眩,19,Southern Song-四書章句集注-中庸章句,得以間之，故臨事而不,眩,。來百工則通功易事，
眩,19,Southern Song-四書章句集注-孟子集注,國。書曰：『若藥不瞑,眩,厥疾不瘳。』」瞑，莫
眩,19,Southern Song-四書章句集注-孟子集注,瘳。』」瞑，莫甸反。,眩,音縣。絕，猶截也。書
眩,19,Southern Song-四書章句集注-孟子集注,也。書商書說命篇。瞑,眩,憒亂。言滕國雖小，猶
眩,8,Eastern Han-釋名-釋疾病,搔發之而揚出也。  ,眩,懸也。目視動亂，如懸
眩,4,Warring States-慎子-逸文,神；登千仞之谿，臨蝯,眩,岸，不足以淆其知。夫
眩,6,Western Han-新書-卷一,白黑，則天下之眾不疑,眩,。因經紀本於天地，政
眩,6,Western Han-新書-卷一,異等同服，則上惡能不,眩,下？孔子曰：「長民者
眩,6,Western Han-新書-卷一,其目，故眾多而天下不,眩,傳遠而天下識祗。卑尊
眩,6,Western Han-新語-資質,，布陳宮堂，望之者目,眩,近之者鼻芳。故事閉之
眩,8,Eastern Han-東觀漢記-紀一,下淺露，中風發疾，苦,眩,。左右有白大司馬史，
眩,8,Eastern Han-東觀漢記-紀三,壇，飾金銀釦器，采色,眩,，祠用三牲，太官設珍
眩,18,Northern Song-太平御覽-天部十三,悟，神彩秀徹，視日不,眩,裴楷目之曰：「戎眼爛
眩,18,Northern Song-太平御覽-地部六,金房，琳瑯焜耀，輝彩,眩,，多珍寶玉器，不可識
眩,18,Northern Song-太平御覽-地部三十一,幽明錄》曰：碩縣下有,眩,，以視之眩人眼，因以
眩,18,Northern Song-太平御覽-地部三十一,碩縣下有眩潭，以視之,眩,眼，因以為名。傍有田
眩,18,Northern Song-太平御覽-地部三十一,下陂不過而死，可為報,眩,。」行人曰：「眩潭無
眩,18,Northern Song-太平御覽-地部三十一,報眩潭。」行人曰：「,眩,無人，云何可報？」烏
眩,18,Northern Song-太平御覽-皇王部十四,宜，好是古非今，使人,眩,名實，何足任！」乃嘆
眩,18,Northern Song-太平御覽-皇王部十八,戰必克。知人善察，難,眩,偽，拔于禁、樂進于行
眩,18,Northern Song-太平御覽-皇王部三十九,殿，遽足不能履地，風,眩,床。自是外不聞上起居
眩,18,Northern Song-太平御覽-偏霸部八,，京兆人劉弘使左道以,眩,百姓，密與實左右十餘
眩,18,Northern Song-太平御覽-皇親部十三,宜，好是古非今，使人,眩,名實，不知所守，何足
眩,18,Northern Song-太平御覽-職官部二,心，沃朕心。若藥不瞑,眩,厥疾弗瘳。」  《韓
眩,18,Northern Song-太平御覽-職官部二十五,斬逆賊而後聞奏，今使,眩,天聰，搖動刑柄。而普
眩,18,Northern Song-太平御覽-職官部二十五,割。」因稱素有風疾，,眩,不堪久侍，遂徒跣趨出
眩,18,Northern Song-太平御覽-職官部三十九,自整頓，宮曰：「夷狄,眩,，非識實也。聞臣虛稱
眩,18,Northern Song-太平御覽-兵部十,整飾，宮對曰：「夷狄,眩,，非識實者也。臣狀丑
眩,18,Northern Song-太平御覽-兵部七十五,。歐冶，良工也。玉工,眩,之似碧盧者，惟猗頓不
眩,18,Northern Song-太平御覽-兵部八十七,震燿，虎士雷噪，望旃,眩,，聞聲喪氣，投戈解甲
眩,18,Northern Song-太平御覽-兵部八十九,人進龍圖之馬。轙駕則,眩,鳳蓋，振鑣則圈促函夏
眩,18,Northern Song-太平御覽-人事部二十,悟，神彩秀徹。視日不,眩,裴楷目之曰：「戎眼爛
眩,18,Northern Song-太平御覽-人事部二十五,悟，神彩秀徹，視日不,眩,裴楷見而目之曰：「戎
眩,18,Northern Song-太平御覽-人事部八十七,悟，神彩秀徹，視日不,眩,裴楷見而目之曰：「戎
眩,18,Northern Song-太平御覽-人事部九十八,眾。諫諍不合，乃伏地,眩,，不復言。帝令兩郎扶
眩,18,Northern Song-太平御覽-禮儀部五,壇，飾淳金釦器，采色,眩,，祠用三牲，太官設珍
眩,18,Northern Song-太平御覽-禮儀部十五,曰：永淳二年，上以風,眩,加，停封中岳。上自東
眩,18,Northern Song-太平御覽-刑法部三,宜，好是古非今，使人,眩,名實，眩，亂視也。音
眩,18,Northern Song-太平御覽-刑法部三,非今，使人眩於名實，,眩,亂視也。音胡亂反切。
眩,18,Northern Song-太平御覽-道部十一,食。此諸公多患風痺及,眩,，皆得愈，但不能大得
眩,18,Northern Song-太平御覽-方術部二,·說命》曰：若藥弗瞑,眩,厥疾弗瘳。開汝心以沃
眩,18,Northern Song-太平御覽-方術部二,沃我心，如服藥。心瞑,眩,，其病乃除，欲其出言
眩,18,Northern Song-太平御覽-方術部二,」中庶子聞扁鵲言，目,眩,而不能瞚，舌撟然而不
眩,18,Northern Song-太平御覽-方術部三,苦頭風，每發，心亂目,眩,他針鬲，隨手而愈。 
眩,18,Northern Song-太平御覽-方術部四,鳴鶴為侍醫。高宗苦風,眩,頭重，目不能視。武后
眩,18,Northern Song-太平御覽-疾病部四,歸，月衰日損。  *,眩, 《釋名》曰：眩，懸
眩,18,Northern Song-太平御覽-疾病部四,*眩  《釋名》曰：,眩,懸也，目視動亂，如懸
眩,18,Northern Song-太平御覽-疾病部四,坐廡下，淺露中風，吐,眩,甚。有曰：「大司馬亦
眩,18,Northern Song-太平御覽-疾病部四,又曰：建武五年，上風,眩,甚。以陰興為侍中，授
眩,18,Northern Song-太平御覽-疾病部四,，呈太祖。太祖先苦風,眩,是日發，讀琳所作，翕
眩,18,Northern Song-太平御覽-疾病部四,褎，入林慮山，中途而,眩,，倚巖而坐，柱杖將起
眩,18,Northern Song-太平御覽-疾病部四,寵歸，昕於道中卒得頭,眩,墜車與，著車上，歸家
眩,18,Northern Song-太平御覽-疾病部六,悔遣之，使呼瓘。瓘辭,眩,動，詐仆地，北出閤。
眩,18,Northern Song-太平御覽-器物部一,作孟碗杯盤也。視之目,眩,希世之巧。羅剎所作，
眩,18,Northern Song-太平御覽-奉使部一,大。以大鳥卵、梨軒善,眩,獻於漢。及宛西小國，
眩,18,Northern Song-太平御覽-資產部四,鄴東起山池游觀，時俗,眩,。孝瑜遂於第作水堂龍
眩,18,Northern Song-太平御覽-妖異部二,名作器，狀如丈夫，善,眩,。以其名呼之即去。又
眩,18,Northern Song-太平御覽-獸部十三,愨字仁祖，常患腰痛，,眩,不堪馳馬。齊主令乘驢
眩,18,Northern Song-太平御覽-羽族部五,愛其毛，終日映水，目,眩,溺。  《臨海異物志
眩,18,Northern Song-太平御覽-羽族部十二,樂，具趟鬮以為膳。鳥,眩,憂悲，不敢食一臠，不
眩,18,Northern Song-太平御覽-藥部一, 《書》曰：若藥弗瞑,眩,厥疾弗瘳。  《周禮
眩,18,Northern Song-太平御覽-藥部九,。生川澤。治大風、頭,眩,、目盲無所見、煩滿，
眩,7,Xin-漢書-紀,宜，好是古非今，使人,眩,名實，不知所守，何足
眩,7,Xin-漢書-紀,勞，不通其理，靡瞻不,眩,靡聽不惑，是以政令多
