query,dynFromId,meta,left,keyword,right
睜,18,Northern Song-廣韻-上聲,也。疾郢切，十。  ,睜,眳睜不恱視也。  𩇕
睜,18,Northern Song-廣韻-上聲,郢切，十。  睜：眳,睜,恱視也。  𩇕：淸飾
睜,24,Ming-西遊記-靈根育孕源流出　心性修持大道生,，徑跳入瀑布泉中，忽,睜,擡頭觀看，那裡邊卻無
睜,24,Ming-西遊記-悟徹菩提真妙理　斷魔歸本合元神,水簾洞洞主？」悟空急,睜,觀看，只見那魔王： 
睜,24,Ming-西遊記-悟徹菩提真妙理　斷魔歸本合元神,頭落下。叫：「孩兒們,睜,。」眾猴腳屣實地，認
睜,24,Ming-西遊記-官封弼馬心何足　名注齊天意未寧,，擺開陣勢。這巨靈神,睜,觀看，真好猴王：  
睜,24,Ming-西遊記-官封弼馬心何足　名注齊天意未寧,」這巨靈神聞此言，急,睜,迎風觀看，果見門外豎
睜,24,Ming-西遊記-亂蟠桃大聖偷丹　反天宮諸神捉怪,七衣仙女，一個個睖睖,睜,，白著眼，都站在桃樹
睜,24,Ming-西遊記-亂蟠桃大聖偷丹　反天宮諸神捉怪,衣仙女，一個個睖睖睜,睜,白著眼，都站在桃樹之
睜,24,Ming-西遊記-觀音赴會問原因　小聖施威降大聖,紫金冠，騰出營門，急,睜,觀看，那真君的相貌果
睜,24,Ming-西遊記-觀音赴會問原因　小聖施威降大聖,，就不見了。」二郎圓,睜,目觀看，見大聖變了麻
睜,24,Ming-西遊記-觀音赴會問原因　小聖施威降大聖,鳥，只有一間小廟。急,睜,眼，仔細看之，見旗竿
睜,24,Ming-西遊記-八卦爐中逃大聖　五行山下定心猿,，只聽得爐頭聲響。猛,睜,看見光明，他就忍不住
睜,24,Ming-西遊記-八卦爐中逃大聖　五行山下定心猿,自低頭看看。」那大聖,睜,火眼金睛，低頭看時，
睜,24,Ming-西遊記-我佛造經傳極樂　觀音奉旨上長安,，你認得我麼？」大聖,睜,火眼金睛，點著頭兒高
睜,24,Ming-西遊記-陳光蕊赴任逢災　江流僧復讎報本,妻正齊齊上船，那劉洪,睜,看見殷小姐面如滿月，
睜,24,Ming-西遊記-陳光蕊赴任逢災　江流僧復讎報本,。眾人不勝驚駭。光蕊,睜,眼，早見殷小姐與丈人
睜,24,Ming-西遊記-老龍王拙計犯天條　魏丞相遺書託冥吏,折，手持利刃兇驍。圓,睜,眼四邊瞧，那個邪神敢
睜,24,Ming-西遊記-唐王秉誠修大會　觀音顯聖化金蟬,我等在此。」宮主擡頭,睜,觀看道：「你是誰人，
睜,24,Ming-西遊記-孫行者大鬧黑風山　觀世音收伏熊羆怪,閃在門外，執著鐵棒，,睜,觀看，只見那怪果生得
睜,24,Ming-西遊記-黃風嶺唐僧有難　半山中八戒爭先,鋼牙錯嚙，滴流流火眼,睜,，掣鐵棒喝道：「你多
睜,24,Ming-西遊記-護法設莊留大聖　須彌靈吉定風魔,睛刮得緊緊閉合，莫能,睜,。因此難使鐵棒，遂敗
睜,24,Ming-西遊記-護法設莊留大聖　須彌靈吉定風魔,伏在山凹之間，也不敢,睜,，不敢擡頭，口裡不住
睜,24,Ming-西遊記-護法設莊留大聖　須彌靈吉定風魔,與行者點上，教他不得,睜,，寧心睡覺，明早就好
睜,24,Ming-西遊記-護法設莊留大聖　須彌靈吉定風魔,更將曉。行者抹抹臉，,睜,眼道：「果然好藥，比
睜,24,Ming-西遊記-護法設莊留大聖　須彌靈吉定風魔,怎的？」行者道：「你,睜,眼睛看看。」獃子忽擡
睜,24,Ming-西遊記-護法設莊留大聖　須彌靈吉定風魔,叮了一個大疙疸。」忽,睜,道：「天亮了。」又聽
睜,24,Ming-西遊記-八戒大戰流沙河　木叉奉法收悟淨,忽聽推得水響，急回頭,睜,觀看，見八戒執鈀來至
睜,24,Ming-西遊記-三藏不忘本　四聖試禪心,，不覺的東方發白。忽,睜,擡頭觀看，那裡得那大
睜,24,Ming-西遊記-鎮元仙趕捉取經僧　孫行者大鬧五莊觀,個大聖鋼牙咬響，火眼,睜,，把條金箍棒揝了又揝
睜,24,Ming-西遊記-鎮元仙趕捉取經僧　孫行者大鬧五莊觀,魔。  二人方醒，忽,睜,，抹抹臉，擡頭觀看，
睜,24,Ming-西遊記-鎮元仙趕捉取經僧　孫行者大鬧五莊觀,打。行者恐仙家法大，,睜,眼瞅定，看他打那裡。
睜,24,Ming-西遊記-屍魔三戲唐三藏　聖僧恨逐美猴王,上雲端裡，手搭涼篷，,睜,觀看。可憐西方路甚是
睜,24,Ming-西遊記-屍魔三戲唐三藏　聖僧恨逐美猴王,，一觔斗，點將回來，,睜,眼金睛觀看，認得那女
睜,24,Ming-西遊記-花果山群妖聚義　黑松林三藏逢魔,至花果山。按落雲頭，,睜,觀看，那山上花草俱無
睜,24,Ming-西遊記-脫難江流來國土　承恩八戒轉山林,，咬響鋼牙；滴溜溜，,睜,環眼；雄糾糾，舉起刀
睜,24,Ming-西遊記-豬八戒義激猴王　孫行者智降妖怪,個立地把身搖。那個大,睜,眼伸猿臂，這個明幌金
睜,24,Ming-西遊記-豬八戒義激猴王　孫行者智降妖怪,主引入朝中去罷。不要,睜,，兄弟們使個縮地法來
睜,24,Ming-西遊記-豬八戒義激猴王　孫行者智降妖怪, 長老現了原身，定性,睜,，才認得是行者。一把
睜,24,Ming-西遊記-平頂山功曹傳信　蓮花洞木母逢災,看來。」  好大聖，,睜,火眼金睛，漫山越嶺的
睜,24,Ming-西遊記-平頂山功曹傳信　蓮花洞木母逢災,。行者道：「這夯貨大,睜,兩個眼，連自家人也認
睜,24,Ming-西遊記-外道迷真性　元神助本心,神念咒來。」那小妖都,睜,眼，看他怎麼樣裝天。
睜,24,Ming-西遊記-外道施威欺正性　心猿獲寶伏邪魔,上罩紅袍烈火然。圓眼,睜,光掣電，鋼鬚飄起亂飛
睜,24,Ming-西遊記-鬼王夜謁唐三藏　悟空神化引嬰兒,，一觔斗，跳在空中。,睜,眼平西看處，果見有一
睜,24,Ming-西遊記-嬰兒問母知邪正　金木參玄見假真,。他卻著實又一淬，忽,睜,見有一座牌樓，上有「
睜,24,Ming-西遊記-嬰兒問母知邪正　金木參玄見假真,，馱上來了。」那行者,睜,看處，真個的背在身上
睜,24,Ming-西遊記-一粒丹砂天上得　三年故主世間生,他原來跳在九霄雲裡，,睜,四望，看那魔王哩。只
睜,24,Ming-西遊記-心猿遭火敗　木母被魔擒,我們在這裡哩。」行者,睜,眼道：「兄弟們在這裡
睜,24,Ming-西遊記-心猿遭火敗　木母被魔擒,就敢請菩薩降我？你大,睜,兩個眼，還不認得我是
睜,24,Ming-西遊記-大聖慇懃拜南海　觀音慈善縛紅孩,見沒了行者。走近前，,睜,眼，對菩薩道：「你是
睜,24,Ming-西遊記-法身元運逢車力　心正妖邪度脊關,，踏雲光，起在空中，,睜,觀看，遠見一座城池。
睜,24,Ming-西遊記-外道弄強欺正法　心猿顯聖滅諸邪,伸手一摸，就笑得呆呆,睜,道：「妙哉，妙哉！卻
睜,24,Ming-西遊記-外道弄強欺正法　心猿顯聖滅諸邪,手一摸，就笑得呆呆睜,睜,：「妙哉，妙哉！卻也
睜,24,Ming-西遊記-三藏有災沉水宅　觀音救難現魚籃,婆，兩三跳跳到門裡。,睜,看時，只見那怪坐在上
睜,24,Ming-西遊記-三藏有災沉水宅　觀音救難現魚籃,裡邊蹕。拽步入深林，,睜,偷覷著。遠觀救苦尊，
睜,24,Ming-西遊記-情亂性從因愛慾　神昏心動遇魔頭,再走。」行者聞言，急,睜,看，只見那壁廂兇雲隱
睜,24,Ming-西遊記-悟空大鬧金兜洞　如來暗示主人公,牙咬響；滴溜溜，環眼,睜,。挺著長槍，帶了寶貝
睜,24,Ming-西遊記-禪主吞餐懷鬼孕　黃婆運水解邪胎,阻住雲角。即按雲光，,睜,看處，好山！但見那：
睜,24,Ming-西遊記-色邪淫戲唐三藏　性正修持不壞身,孫問他去來。」行者急,睜,看，只見頭直上有祥雲
睜,24,Ming-西遊記-荊棘嶺悟能努力　木仙庵三藏談詩,。」那長老卻才定性，,睜,仔細觀看。真個是： 
睜,24,Ming-西遊記-諸神遭毒手　彌勒縛妖魔,在須臾間矣。」行者急,睜,跳起來看，原來是日值
睜,24,Ming-西遊記-拯救駝羅禪性穩　脫離穢污道心清,沙僧蒙著頭臉，眼也難,睜,  行者聞風認怪，一
睜,24,Ming-西遊記-行者假名降怪犼　觀音現像伏妖王,「娘娘開眼。」那皇后,睜,眼看，認得是鳳閣龍樓
睜,24,Ming-西遊記-比丘憐子遣陰神　金殿識魔談道德,猛然驚覺，麻麻糊糊的,睜,眼，看見行者，連忙跪
睜,24,Ming-西遊記-尋洞擒妖逢老壽　當朝正主救嬰兒,」  那國丈聽見，急,睜,仔細觀看，見那和尚變
睜,24,Ming-西遊記-鎮海寺心猿知怪　黑松林三眾尋師,酒，輕輕呼了六七鍾。,睜,一雙不白不黑的金睛眼
睜,24,Ming-西遊記-鎮海寺心猿知怪　黑松林三眾尋師,芳心嗔黑禿，一個兒圓,睜,眼恨新妝。兩手劍飛，
睜,24,Ming-西遊記-姹女求陽　元神護道,看。」  好大聖，急,睜,眼金睛，漫山看處，果
睜,24,Ming-西遊記-難滅伽持圓大覺　法王成正體天然,，驚醒國王。那國王急,睜,，見皇后的頭光，他連
睜,24,Ming-西遊記-心猿妒木母　魔主計吞禪,空。用手搭在眉上，圓,睜,眼，向下觀之，果見那
睜,24,Ming-西遊記-木母助威征怪物　金公施法滅妖邪,閃過，使杵抵住鐵棒，,睜,眼問道：「你這嘴臉像
睜,24,Ming-西遊記-黃獅精虛設釘鈀宴　金木土計鬧豹頭山,把兩個狼頭精定住。眼,睜,，口也難開；直挺挺，
睜,24,Ming-西遊記-黃獅精虛設釘鈀宴　金木土計鬧豹頭山,兩個狼頭精定住。眼睜,睜,口也難開；直挺挺，雙
睜,24,Ming-西遊記-假合真形擒玉兔　真陰歸正會靈元,毘盧帽頂上，運神光，,睜,眼金睛觀看。又只見那
睜,24,Ming-西遊記-金酬外護遭魔蟄　聖顯幽魂救本原,來名，一個個咬著牙，,睜,眼，撒著手，直直的站
睜,24,Ming-西遊記-金酬外護遭魔蟄　聖顯幽魂救本原,甚疏失。行者近前努目,睜,，厲聲高叫道：「我的
睜,18,Northern Song-太平御覽-布帛部六,合，輕騎挑戰。侯安都,睜,橫矛，單騎突陣，四向
睜,18,Northern Song-太平御覽-飲食部四,為瘦。」真愈恚，拔刀,睜,，言：「俳敢輕說，吾
睜,18,Northern Song-太平御覽-咎徵部三,三年二月，大風暴雨，,睜,怗門。至六年，壽死，
睜,18,Northern Song-太平御覽-咎徵部七,地震，臣下強盛，地故,睜,匽，冀所以警悟人主，
睜,25,Qing-儒林外史-說楔子敷陳大義　借名流隱括全文,臉。少頃，風聲略定，,睜,看時，只見天上紛紛有
睜,25,Qing-儒林外史-王秀才議立偏房　嚴監生疾終正寢,吩咐明白？」他把兩眼,睜,溜圓，把頭又狠狠搖了
睜,25,Qing-儒林外史-鄉紳發病鬧船家　寡婦含冤控大伯,著，一鬨去了。船家眼,睜,看著他走去了  嚴貢
睜,25,Qing-儒林外史-鄉紳發病鬧船家　寡婦含冤控大伯,，一鬨去了。船家眼睜,睜,著他走去了  嚴貢生
睜,25,Qing-儒林外史-鄉紳發病鬧船家　寡婦含冤控大伯,要開口說話，被嚴貢生,睜,眼睛，喝了一聲，又不
睜,25,Qing-儒林外史-婁公子捐金贖朋友　劉守備冒姓打船家,道：「狗攮的奴才！你,睜,驢眼看看燈籠上的字！
睜,25,Qing-儒林外史-魯小姐制義難新郎　楊司訓相府薦賢士,喫。楊執中罵他，他還,睜,醉眼混回嘴。楊執中急
睜,25,Qing-儒林外史-名士大宴鶯脰湖　俠客虛設人頭會,，夜役喝著叫他跪，他,睜,眼不肯跪。  這時街
睜,25,Qing-儒林外史-名士大宴鶯脰湖　俠客虛設人頭會,了。把個權勿用氣的眼,睜,，敢怒而不敢言，真是
睜,25,Qing-儒林外史-名士大宴鶯脰湖　俠客虛設人頭會,。把個權勿用氣的眼睜,睜,敢怒而不敢言，真是說
睜,25,Qing-儒林外史-蘧公孫書坊送良友　馬秀才山洞遇神仙,交，我同他是深交，眼,睜,看他有事，不能替他掩
睜,25,Qing-儒林外史-蘧公孫書坊送良友　馬秀才山洞遇神仙,，我同他是深交，眼睜,睜,他有事，不能替他掩下
睜,25,Qing-儒林外史-冒姓字小子求名　念親戚老夫臥病,漸的撐不住了，氣的眼,睜,說不出話來。到晚，牛
睜,25,Qing-儒林外史-冒姓字小子求名　念親戚老夫臥病,的撐不住了，氣的眼睜,睜,不出話來。到晚，牛浦
睜,25,Qing-儒林外史-發陰私詩人被打　歎老景寡婦尋夫,，喫了早飯，牛玉圃圓,睜,眼，大怒道：「你可曉
睜,25,Qing-儒林外史-牛浦郎牽連多訟事　鮑文卿整理舊生涯,條牛見這和尚，把兩眼,睜,的只望著他。和尚覺得
睜,25,Qing-儒林外史-牛浦郎牽連多訟事　鮑文卿整理舊生涯,牛見這和尚，把兩眼睜,睜,只望著他。和尚覺得心
睜,25,Qing-儒林外史-季葦蕭揚州入贅　蕭金鉉白下選書,廷璽聽了這話，兩眼大,睜,，話也說不出來，慌問
睜,25,Qing-儒林外史-郭孝子深山遇虎　甘露僧狹路逢讎,竟自己走到床上坐下，,睜,眼道：「你今日既到我
睜,25,Qing-儒林外史-莊濯江話舊秦淮河　沈瓊枝押解江都縣,眼閉著，只有這一夜才,睜,眼。若見滿城都擺的香
睜,25,Qing-儒林外史-敦友誼代兄受過　講堪輿回家葬親,商議。他家一門都是龍,睜,眼的腳色，只有三老還
睜,25,Qing-儒林外史-敦友誼代兄受過　講堪輿回家葬親,侵慢的嚼。嚼了半日，,睜,眼，又把那土拿在鼻子
睜,25,Qing-儒林外史-敦友誼代兄受過　講堪輿回家葬親,彎曲曲做了一個來龍，,睜,眼道：「我這地要出個
睜,25,Qing-儒林外史-虞秀才重修元武閣　方鹽商大鬧節孝祠,他出去成田契。虞華軒,睜,眼道：「那田貴了！我
睜,25,Qing-儒林外史-翰林高談龍虎榜　中書冒占鳳凰池,十多歲的大漢，兩眼圓,睜,雙眉直豎，一部極長的
睜,25,Qing-儒林外史-病佳人青樓算命　呆名士妓館獻詩,要是不吃﹐就只好是眼,睜,的一夜醒到天亮。」陳
睜,25,Qing-儒林外史-病佳人青樓算命　呆名士妓館獻詩,是不吃﹐就只好是眼睜,睜,一夜醒到天亮。」陳木
睜,25,Qing-儒林外史-病佳人青樓算命　呆名士妓館獻詩,音菩薩聽著﹐我怎肯眼,睜,的看著你上當不說？」
睜,25,Qing-儒林外史-病佳人青樓算命　呆名士妓館獻詩,菩薩聽著﹐我怎肯眼睜,睜,看著你上當不說？」陳
睜,25,Qing-儒林外史-病佳人青樓算命　呆名士妓館獻詩,們沒眼的算命﹐這些年,睜,的人都來算命﹐把我們
睜,25,Qing-康熙字典-手部,切《集韻》張梗切，𠀤,睜,聲。揮張也。又《唐韻
睜,25,Qing-康熙字典-目部,韻》疾郢切，音穽。與,睜,。  睜：《廣韻》《
睜,25,Qing-康熙字典-目部,，音穽。與睜同。  ,睜,《廣韻》《集韻》𠀤疾
睜,25,Qing-康熙字典-目部,切，音穽。《字林》眳,睜,不悅視也。或作睛。俗
睜,25,Qing-康熙字典-目部,悅視也。或作睛。俗作,睜,  睝：《集韻》良脂
睜,25,Qing-紅樓夢-賈寶玉神遊太虛境　警幻仙曲演紅樓夢,正好，恨無常又到。眼,睜,，把萬事全拋。蕩悠悠
睜,25,Qing-紅樓夢-賈寶玉神遊太虛境　警幻仙曲演紅樓夢,好，恨無常又到。眼睜,睜,把萬事全拋。蕩悠悠，
睜,25,Qing-紅樓夢-王熙鳳毒設相思局　賈天祥正照風月鑒,，「噯喲」了一聲，一,睜,，鏡子從新又掉過來，
睜,25,Qing-紅樓夢-王熙鳳毒設相思局　賈天祥正照風月鑒,著鏡子照，落下來，仍,睜,眼拾在手內，末後鏡子
睜,25,Qing-紅樓夢-情切切良宵花解語　意綿綿靜日玉生香,婆子的。」黛玉聽了，,睜,眼起身，笑道：「真真
睜,25,Qing-紅樓夢-賢襲人嬌嗔箴寶玉　俏平兒軟語救賈璉,了？」連問幾聲。襲人,睜,說道：「我也不怎麼著
睜,25,Qing-紅樓夢-西廂記妙詞通戲語　牡丹亭艷曲警芳心,非蹙的眉，瞪了一雙似,睜,睜的眼，桃腮帶怒，薄
睜,25,Qing-紅樓夢-西廂記妙詞通戲語　牡丹亭艷曲警芳心,的眉，瞪了一雙似睜非,睜,眼，桃腮帶怒，薄面含
睜,25,Qing-紅樓夢-醉金剛輕財尚義俠　癡女兒遺帕惹相思,一聽他的語音，將醉眼,睜,一看，見是賈芸，忙鬆
睜,25,Qing-紅樓夢-魘魔法叔嫂逢五鬼　通靈玉蒙蔽遇雙真,困扶危的人，難道就眼,睜,的看著人家來擺佈死了
睜,25,Qing-紅樓夢-魘魔法叔嫂逢五鬼　通靈玉蒙蔽遇雙真,扶危的人，難道就眼睜,睜,看著人家來擺佈死了我
睜,25,Qing-紅樓夢-魘魔法叔嫂逢五鬼　通靈玉蒙蔽遇雙真, 至第四日早，寶玉忽,睜,眼向賈母說道：「從今
睜,25,Qing-紅樓夢-寶釵借扇機帶雙敲　椿齡畫薔癡及局外,上的墜子一摘，金釧兒,睜,，見是寶玉。寶玉便悄
睜,25,Qing-紅樓夢-寶釵借扇機帶雙敲　椿齡畫薔癡及局外,嘴裡一送。金釧兒也不,睜,，只管噙了。  寶玉
睜,25,Qing-紅樓夢-寶釵借扇機帶雙敲　椿齡畫薔癡及局外,了，我就說。」金釧兒,睜,眼，將寶玉一推，笑道
睜,25,Qing-紅樓夢-寶釵借扇機帶雙敲　椿齡畫薔癡及局外,痰來，「噯喲」一聲，,睜,見了寶玉，倒唬了一跳
睜,25,Qing-紅樓夢-手足眈眈小動唇舌　不肖種種大承笞撻,罵：「糊塗東西！也不,睜,眼瞧瞧。這個樣兒，怎
睜,25,Qing-紅樓夢-情中情因情感妹妹　錯裡錯以錯勸哥哥,又讓坐。  寶釵見他,睜,眼說話，不像先時，心
睜,25,Qing-紅樓夢-情中情因情感妹妹　錯裡錯以錯勸哥哥,聲。寶玉從夢中驚醒，,睜,一看，不是別人，卻是
睜,25,Qing-紅樓夢-賈寶玉品茶櫳翠庵　劉姥姥醉臥怡紅院,推醒。那劉姥姥驚醒，,睜,看見襲人，連忙爬起來
睜,25,Qing-紅樓夢-濫情人情誤思遊藝　慕雅女雅集苦吟詩,以後，上床躺下，兩眼,睜,，直到五更，方纔朦朧
睜,25,Qing-紅樓夢-濫情人情誤思遊藝　慕雅女雅集苦吟詩,後，上床躺下，兩眼睜,睜,直到五更，方纔朦朧睡
睜,25,Qing-紅樓夢-俏平兒情掩蝦鬚鐲　勇晴雯病補孔雀裘,氣的蛾眉倒蹙，鳳眼園,睜,即時就叫墜兒。寶玉忙
睜,25,Qing-紅樓夢-辱親女愚妾爭閒氣　欺幼主刁奴蓄險心,先道：「你忙什麼？你,睜,眼看見姑娘洗臉，你不
睜,25,Qing-紅樓夢-壽怡紅群芳開夜宴　死金丹獨豔理親喪,。  及至天明，襲人,睜,一看，只見天色晶明，
睜,25,Qing-紅樓夢-情小妹恥情歸地府　冷二郎一冷入空門,夢中哭醒，似夢非夢，,睜,看時，竟是一座破廟，
睜,25,Qing-紅樓夢-凸碧堂品笛感淒清　凹晶館聯詩悲寂寞,王夫人輕輕叫請。賈母,睜,笑道：「我不困，白閉
睜,25,Qing-紅樓夢-俏丫鬟抱屈夭風流　美優伶斬情歸水月,：「阿彌陀佛！今日天,睜,眼，把這個禍害妖精退
睜,25,Qing-紅樓夢-俏丫鬟抱屈夭風流　美優伶斬情歸水月,。剛繫腰時，只見晴雯,睜,道：「你扶起我來坐坐
睜,25,Qing-紅樓夢-老學士閒徵姽嫿詞　癡公子杜撰芙蓉誄,死不變。見我去了，便,睜,眼拉我的手問：『寶玉
睜,25,Qing-紅樓夢-省宮闈賈元妃染恙　鬧閨閫薛寶釵吞聲,湯送到唇邊。黛玉微微,睜,喝了兩三口，便搖搖頭
睜,25,Qing-紅樓夢-省宮闈賈元妃染恙　鬧閨閫薛寶釵吞聲,痰盒兒接痰。黛玉微微,睜,問道：「你合誰說話呢
睜,25,Qing-紅樓夢-失綿衣貧女耐嗷嘈　送果品小郎驚叵測,仍舊躺下。半日，微微,睜,，說道：「剛才說話不
睜,25,Qing-紅樓夢-失綿衣貧女耐嗷嘈　送果品小郎驚叵測,因連忙過來問候。黛玉,睜,看了，點點頭兒，又歇
睜,25,Qing-紅樓夢-林黛玉焚稿斷癡情　薛寶釵出閨成大禮,都慌了。只見黛玉微微,睜,，看見賈母在他旁邊，
睜,25,Qing-紅樓夢-林黛玉焚稿斷癡情　薛寶釵出閨成大禮,連一個問的人都沒有，,睜,眼，只有紫鵑一人，自
睜,25,Qing-紅樓夢-林黛玉焚稿斷癡情　薛寶釵出閨成大禮,喚他，那紫鵑纔慢慢的,睜,眼，欠起身來。李紈道
睜,25,Qing-紅樓夢-林黛玉焚稿斷癡情　薛寶釵出閨成大禮,，鶯兒上來伺候。寶玉,睜,一看，好像是寶釵。心
睜,25,Qing-紅樓夢-苦絳珠魂歸離恨天　病神瑛淚灑相思地,玉卻又緩過來了，微微,睜,眼，似有要水要湯的光
睜,25,Qing-紅樓夢-苦絳珠魂歸離恨天　病神瑛淚灑相思地,回事情。  這裡黛玉,睜,眼一看，只有紫鵑和奶
睜,25,Qing-紅樓夢-大觀園月夜警幽魂　散花寺神籤驚異兆,姐兒哭了，鳳姐又將眼,睜,。平兒連向那邊叫道：
睜,25,Qing-紅樓夢-大觀園月夜警幽魂　散花寺神籤驚異兆,冷汗，「噯喲」一聲，,睜,眼，只見賈璉氣狠狠的
睜,25,Qing-紅樓夢-錦衣軍查抄寧國府　驄馬使彈劾平安州,纔好。獨見鳳姐先前圓,睜,眼聽著，後來一仰身，
睜,25,Qing-紅樓夢-王熙鳳致禍抱羞慚　賈太君禱天消禍患,呢！」  鳳姐聽見，,睜,一瞧，雖不言語，那眼
睜,25,Qing-紅樓夢-候芳魂五兒承錯愛　還孽債迎女返真元,又打起坐來了？」寶玉,睜,眼看見襲人，便道：「
睜,25,Qing-紅樓夢-候芳魂五兒承錯愛　還孽債迎女返真元,鴦自去料理。  賈母,睜,要茶喝，邢夫人便進了
睜,25,Qing-紅樓夢-史太君壽終歸地府　王鳳姐力詘失人心,緊了，合了一回眼，又,睜,滿屋裡瞧了一瞧。王夫
睜,25,Qing-紅樓夢-活冤孽妙姑遭大劫　死讎仇趙妾赴冥曹,又不聽見妙玉言語，只,睜,兩眼聽著。到了天亮，
睜,25,Qing-紅樓夢-活冤孽妙姑遭大劫　死讎仇趙妾赴冥曹,沒聽見？只是我們都是,睜,眼，連一句話也說不出
睜,25,Qing-紅樓夢-懺宿冤鳳姐託村嫗　釋舊憾情婢感癡郎,「奶奶要什麼？」鳳姐,睜,一瞧，不見有人，心裡
睜,25,Qing-紅樓夢-懺宿冤鳳姐託村嫗　釋舊憾情婢感癡郎,「請姑奶奶安。」鳳姐,睜,一看，不覺一陣傷心，
睜,25,Qing-紅樓夢-惑偏私惜春矢素志　證同類寶玉失相知,王夫人等見寶玉把眼一,睜,襲人說道：「好了！」
睜,25,Qing-紅樓夢-得通靈幻境悟仙緣　送慈柩故鄉全孝道,甦來，連忙叫喚。寶玉,睜,看時，仍躺在炕上，見
睜,25,Qing-紅樓夢-甄士隱詳說太虛情　賈雨村歸結紅樓夢,了，姐姐吃罷。」襲人,睜,一瞧，知是個夢，也不
睜,24,Ming-封神演義-冀州侯蘇護反商,那分上下，那個兩眼難,睜,你拿我，凌湮閣上標名
睜,24,Ming-封神演義-冀州侯蘇護反商,金小校，懨懨二目竟難,睜,擂鼓兒郎，漸漸雙手不
睜,24,Ming-封神演義-雲中子進劍除妖,不題。──只見妲己微,睜,眼，強啟朱唇，作呻吟
睜,24,Ming-封神演義-方弼方相反朝歌,」姜后屈刑凌陷，一目,睜,，罵曰：「你這賊子！
睜,24,Ming-封神演義-方弼方相反朝歌,刑。」姜后聞子之聲，,睜,一目，母見其子，大叫
睜,24,Ming-封神演義-哪吒現蓮花化身,鄧金柱子站著。哪吒及,睜,看時，把身子動不得了
睜,24,Ming-封神演義-哪吒現蓮花化身,」道人忙收寶塔。哪吒,睜,一看，渾身上下，莫莫
睜,24,Ming-封神演義-崑崙山子牙下山,淺不能全！紅塵黯黯難,睜,；浮世紛紛怎脫肩。借
睜,24,Ming-封神演義-子牙諫主隱磻溪,若聽得耳內風響，不要,睜,。開了眼時，跌出腦子
睜,24,Ming-封神演義-子牙諫主隱磻溪,：「眾人開眼！」眾人,睜,了眼。子牙曰：「此處
睜,24,Ming-封神演義-散宜生私通費尤,眾文武切齒咬牙，豎眉,睜,，七間殿上，一片喧嚷
睜,24,Ming-封神演義-西伯侯文王吐子,，已出五關了。」文王,睜,二目，已知是本土，大
睜,24,Ming-封神演義-太師回兵陳十策,招，見招豎目揚眉，圓,睜,眼，面君不拜。紂王曰
睜,24,Ming-封神演義-太師回兵陳十策,只急得當中那一只神目,睜,，白光現尺餘遠近。命
睜,24,Ming-封神演義-太師回兵陳十策,」太師聽說，當中神目,睜,，長髯直豎，大聲曰：
睜,24,Ming-封神演義-黃天化潼關會父,一聲：「疼殺吾也！」,睜,雙目，只見一個道童坐
睜,24,Ming-封神演義-黃飛虎泗水大戰,必如此？」黃滾醒回，,睜,大罵：「無知強盜！你
睜,24,Ming-封神演義-張桂芳奉詔西征,那分上下，棒去兩眼難,睜,你拏我，誅身報國輔明
睜,24,Ming-封神演義-姜子牙一上崑崙,一磨，纔磨正了。把眼,睜,看，見南極仙翁站立。
睜,24,Ming-封神演義-四聖西岐會子牙,無名之火，持劍在手，,睜,欲來取文殊廣法天尊。
睜,24,Ming-封神演義-姜子牙冰凍岐山,銅鼓振，眾將校兩眼難,睜,一時把金風撤去無蹤影
睜,24,Ming-封神演義-聞太師兵伐西岐,黃天化已是回生，二目,睜,，見師父在傍，天化曰
睜,24,Ming-封神演義-聞太師兵伐西岐,將！」聞太師當中一目,睜,，白光有二尺遠近；只
睜,24,Ming-封神演義-聞太師兵伐西岐,生乎！」聞太師當中眼,睜,看時，好兇惡之像，二
睜,24,Ming-封神演義-聞大師西岐大戰,鳴金小校，灰迷二目難,睜,擂鼓兒郎，兩手慌忙槌
睜,24,Ming-封神演義-聞大師西岐大戰,被辱，只急得當中神目,睜,，長圩短歎。吉立迎前
睜,24,Ming-封神演義-子牙魂游崑崙山,依舊入竅。少時，子牙,睜,眼，口稱：「好睡！」
睜,24,Ming-封神演義-公明輔佐聞太師,：「痛殺吾也！」二目,睜,，只見武王、廣成子俱
睜,24,Ming-封神演義-陸壓獻計射公明,曰：「趙道兄，」公明,睜,見聞太師來至，就問搶
